27827,9989,The Kama Sutra of Vatsyayana: Translated From the Sanscrit in Seven Parts With Preface, Introduction and Concluding Remarks
174,7652,The Picture of Dorian Gray
158,6846,Emma
16328,5359,Beowulf: An Anglo-Saxon Epic Poem
20203,5072,Autobiography of Benjamin Franklin
2500,4725,Siddhartha
526,4362,Heart of Darkness
8800,4028,The Divine Comedy by Dante, Illustrated
35,3732,The Time Machine
2852,3358,The Hound of the Baskervilles
219,3243,Heart of Darkness
7370,3222,Second Treatise of Government
863,3112,The Mysterious Affair at Styles
2147,3075,The Works of Edgar Allan Poe — Volume 1
10676,2958,The Reign of Greed
4517,2895,Ethan Frome
28520,2716,Forbidden Fruit: Luscious and exciting story and More forbidden fruit or: Master Percy's progress in and beyond the domestic circle
2413,2499,Madame Bovary
41,2428,The Legend of Sleepy Hollow
1524,2329,Hamlet, Prince of Denmark
14591,2289,Faust
1727,2190,The Odyssey: Rendered into English prose for the use of those who cannot read the original
779,2133,The Tragical History of Doctor Faustus: From the Quarto of 1604
1155,2070,The Secret Adversary
22381,1984,Myths and Legends of Ancient Greece and Rome
4093,1974,Hedda Gabler
2527,1653,The Sorrows of Young Werther
2428,1646,An Essay on Man; Moral Essays and Satires
31,1589,Plays of Sophocles: Oedipus the King; Oedipus at Colonus; Antigone
110,1570,Tess of the d'Urbervilles: A Pure Woman
1754,1551,The Sea-Gull
541,1546,The Age of Innocence
9622,1515,Lyrical Ballads, With a Few Other Poems (1798)
11224,1512,Utilitarianism
59,1508,Discourse on the Method of Rightly Conducting One's Reason and of Seeking Truth in the Sciences
6852,1471,Venus in Furs
932,1460,The Fall of the House of Usher
10007,1416,Carmilla
8164,1317,My Man Jeeves
51125,1282,Mars is my Destination
51115,1280,Transfer Point
139,1274,The Lost World
8789,1232,The vision of hell. : By Dante Alighieri.: Translated by Rev. Henry Francis Cary, M.A.: and illustrated with the seventy-five designs of Gustave Doré.
3176,1196,The Innocents Abroad
228,1152,The Aeneid
902,1141,The Happy Prince, and Other Tales
102,1140,The Tragedy of Pudd'nhead Wilson
51122,1129,The Men in the Walls
208,1101,Daisy Miller: A Study
159,1083,The Island of Doctor Moreau
1001,1080,Divine Comedy, Longfellow's Translation, Hell
11339,1074,Aesop's Fables; a new translation
284,1065,The House of Mirth
2265,1051,Hamlet
2610,1031,Notre-Dame De Paris
15250,1021,Myths and Legends of China
11231,1019,Bartleby, the Scrivener: A Story of Wall-Street
1254,1018,Cyrano de Bergerac
38427,1011,The World as Will and Idea (Vol. 1 of 3)
558,989,The Thirty-Nine Steps
201,984,Flatland: A Romance of Many Dimensions (Illustrated)
10947,955,The Best American Humorous Short Stories
27,947,Far from the Madding Crowd
8121,944,Ghosts
18857,940,A Journey to the Centre of the Earth
82,923,Ivanhoe: A Romance
4507,920,As a Man Thinketh
51152,919,Appointment In Tomorrow
51002,911,Korean Folk Tales: Imps, Ghosts and Faries
50961,909,The Slipper Point Mystery
383,903,She Stoops to Conquer; Or, The Mistakes of a Night: A Comedy
946,894,Lady Susan
42474,888,1000 Mythological Characters Briefly Described: Adapted to Private Schools, High Schools and Academies
15489,868,Dream Psychology: Psychoanalysis for Beginners
19322,862,The Antichrist
51041,862,The Horses of the Sahara: And the Manners of the Desert
51184,855,Inside Earth
601,834,The Monk: A Romance
1041,831,Shakespeare's Sonnets
7213,826,My Life and Work
51167,826,Butterfly 9
51189,816,The Lover's Baedeker and Guide to Arcady
389,807,The Great God Pan
204,800,The Innocence of Father Brown
29433,800,Nature
32803,790,Letters from a Father to His Son Entering College
175,784,The Phantom of the Opera
148,782,The Autobiography of Benjamin Franklin
2242,761,A Midsummer Night's Dream
2267,760,Othello
51057,758,Lady Jane Grey and Her Times
1093,754,The Beast in the Jungle
4081,744,The Alchemist
20916,741,The Arabian Nights: Their Best-known Tales
854,729,A Woman of No Importance
20480,728,Palmistry for All
51067,719,Living Too Fast: The Confessions of a Bank Officer
981,718,Beowulf
50995,714,Mad Barbara
51042,713,The Nakimu Caves: Glacier Dominion Park, B. C.
1268,711,The Mysterious Island
2027,711,Tartuffe; Or, The Hypocrite
60,710,The Scarlet Pimpernel
19721,709,The Literary World Seventh Reader
50969,695,Big Ancestor
51070,683,Raiders of the Sarhad: Being an Account of the Campaign of Arms and Bluff Against the Brigands of the Persian-Baluchi Border during the Great War
50906,682,Savrola: A Tale of the Revolution in Laurania
816,681,Democracy in America — Volume 2
29827,678,The Life and Amours of the Beautiful, Gay and Dashing Kate Percival: The Belle of the Delaware
12242,671,Poems by Emily Dickinson, Three Series, Complete
41481,650,Astounding Stories of Super-Science January 1930
3178,647,The Gilded Age: A Tale of Today
1091,622,On Heroes, Hero-Worship, and the Heroic in History
32154,618,The Variable Man
153,613,Jude the Obscure
8710,612,The Doré Bible Gallery, Complete: Containing One Hundred Superb Illustrations, and a Page of Explanatory Letter-press Facing Each
19068,608,Household Stories by the Brothers Grimm
107,606,Far from the Madding Crowd
2446,595,An Enemy of the People
1636,594,Phaedrus
50986,591,Glaciers of the Rockies and Selkirks, 2nd. ed.: With Notes on Five Great Glaciers of the Canadian National Parks
544,586,Anne's House of Dreams
1245,579,Night and Day
4763,576,The Game of Logic
2759,575,The Man in the Iron Mask
51078,572,Venoms: Venomous Animals and Antivenomous Serum-therapeutics
3160,571,The Odyssey
16436,570,Poems Every Child Should Know: The What-Every-Child-Should-Know-Library
4078,565,The Picture of Dorian Gray
51049,560,The History and Romance of Crime. Modern French Prisons
4039,558,Volpone; Or, The Fox
11000,558,An Old Babylonian Version of the Gilgamesh Epic
1237,555,Father Goriot
8147,552,The Man Who Would Be King
3070,549,The Hound of the Baskervilles
1128,548,The Tragedy of King Lear
3250,541,How to Tell a Story, and Other Essays
143,538,The Mayor of Casterbridge
51143,538,The Waterloo Roll Call: With Biographical Notes and Anecdotes
1977,536,Phaedra
2232,534,The Duchess of Malfi
28497,530,Myths of the Norsemen: From the Eddas and Sagas
456,513,The Door in the Wall, and Other Stories
51118,510,A History of Southern Missouri and Northern Arkansas: Being an Account of the Early Settlements, the Civil War, the Ku-Klux, and Times of Peace
11012,509,The Autobiography of an Ex-Colored Man
9830,508,The Beautiful and Damned
25447,507,Mysticism and Logic and Other Essays
1164,506,The Iron Heel
2243,506,The Merchant of Venice
2891,505,Howards End
45109,503,The Enchiridion
51077,501,The Amateur Diplomat: A Novel
3188,500,Mark Twain's Speeches
1120,496,The Tragedy of Julius Caesar
51103,495,A Chautauqua Idyl
769,494,The Book of Tea
51174,488,The Man in Black: An Historical Novel of the Days of Queen Anne
790,485,Lady Windermere's Fan
4357,485,American Fairy Tales
51201,485,Volpla
122,481,The Return of the Native
15237,476,The Chemistry of Food and Nutrition
41537,471,The Divine Comedy of Dante Alighieri: The Inferno
1298,462,The Virginian: A Horseman of the Plains
325,461,Phantastes: A Faerie Romance for Men and Women
9070,460,The Imaginary Invalid
50905,459,Yesterday House
50990,459,Spanish and Portuguese South America during the Colonial Period; Vol. 1 of 2
11438,457,The Willows
14640,452,McGuffey's First Eclectic Reader, Revised Edition
3330,442,The Analects of Confucius (from the Chinese Classics)
6626,440,Theresa Raquin
1874,437,The Railway Children
50936,437,Man in a Sewing Machine
1643,435,Meno
2153,431,Mary Barton
2895,429,Following the Equator: A Journey Around the World
23666,429,Mission Furniture: How to Make It, Part 3
51106,426,The Mentor: The Story of Coal, vol. 6, Num. 6, Serial No. 154, May 1, 1918
1872,422,The Red House Mystery
51187,420,A Visit to the Mammoth Cave of Kentucky
969,419,The Tenant of Wildfell Hall
3761,419,This Country of Ours
1929,417,The School for Scandal
1153,409,The Chessmen of Mars
51095,409,Book of Mormon Stories: Adapted to the Capacity of Young Children
51169,409,Section Cutting and Staining: A practical introduction to histological methods for students and practitioners
24761,408,The Rivals: A Comedy
51209,408,Babes in the Bush
33447,403,The Pencil of Nature
2021,402,Nostromo: A Tale of the Seaboard
20657,401,Tales from Shakespeare
32832,395,Piper in the Woods
1719,394,The Ballad of the White Horse
14033,390,Plutarch's Lives, Volume I
811,389,The Tragical History of Doctor Faustus: From the Quarto of 1616
8954,388,Lady Audley's Secret
2042,384,Something New
1107,383,The Taming of the Shrew
807,372,Hunted Down: The Detective Stories of Charles Dickens
1717,370,What's Wrong with the World
50993,369,Lion Ben of Elm Island: Elm Island Stories
10607,367,The Real Mother Goose
50953,366,The making of a bigot
35977,364,Letters of Abelard and Heloise: To which is prefix'd a particular account of their lives, amours, and misfortunes
25016,362,The House of Souls
1787,361,Hamlet
4070,360,The Master Builder
5186,357,Kalevala : the Epic Poem of Finland — Complete
51206,356,True Stories of the Great War, Volume VI (of 6): Tales of Adventure—Heroic Deeds—Exploits Told by the Soldiers, Officers, Nurses, Diplomats, Eye Witnesses
8092,352,Tremendous Trifles
689,351,The Kreutzer Sonata and Other Stories
1450,349,Pollyanna
10940,348,Manners, Customs, and Dress During the Middle Ages and During the Renaissance Period
50958,348,Representative Women of Deseret: A Book of Biographical Sketches
25012,346,The Case Of Wagner, Nietzsche Contra Wagner, and Selected Aphorisms.
22456,344,The Aeneid of Virgil
5307,342,The Letters of Wolfgang Amadeus Mozart — Volume 01
95,339,The Prisoner of Zenda
97,338,Flatland: A Romance of Many Dimensions
171,337,Charlotte Temple
31189,335,The Monster and Other Stories
559,333,Greenmantle
51235,331,Robert Helmont: Diary of a Recluse 1870-1871
9296,330,Clarissa Harlowe; or the history of a young lady — Volume 1
25609,330,A Child's Garden of Verses
38594,330,Poems
1026,329,The Diary of a Nobody
51228,326,The Flower-Patch Among the Hills
51181,323,History of Greece, Volume 7 (of 12)
30120,321,The Happy Prince and Other Tales
51160,320,XXXII Ballades in Blue China [1885]
1289,319,Three Ghost Stories
1240,317,The Playboy of the Western World: A Comedy in Three Acts
549,313,The Underdogs: A Novel of the Mexican Revolution
6923,313,The Miser
32530,313,Armageddon—2419 A.D.
165,311,McTeague: A Story of San Francisco
49525,311,First Lensman
572,307,The Great Big Treasury of Beatrix Potter
7841,307,A Primary Reader: Old-time Stories, Fairy Tales and Myths Retold by Children
5267,306,Sister Carrie
33870,304,Chess Fundamentals
35242,304,The Awakening of Spring: A Tragedy of Childhood
27761,301,Hamlet, Prince of Denmark
8190,300,A Wodehouse Miscellany: Articles & Stories
123,296,At the Earth's Core
46091,296,The Octoroon: or, Life in Louisiana; A Play in Five acts
51097,296,Heroines of Mormondom: The Second Book of the Noble Women's Lives Series
10577,294,International Short Stories: French
1526,292,Twelfth Night; Or, What You Will
3794,292,L. Annaeus Seneca on Benefits
8867,292,The Magnificent Ambersons
4583,291,Dialogues Concerning Natural Religion
2240,289,Much Ado about Nothing
15097,289,A Grammar of the English Tongue
4368,287,Flappers and Philosophers
28346,287,Deathworld
51200,286,Passamaquoddy Texts
2870,285,Washington Square
27523,285,Masterpieces of Mystery in Four Volumes: Detective Stories
177,283,The American
1688,279,The People of the Abyss
4776,278,Political Ideals
34994,275,Morning and Evening Prayers for All Days of the Week: Together With Confessional, Communion, and Other Prayers and Hymns for Mornings and Evenings, and Other Occasions
3023,273,Faust — Part 1
28255,272,Shelters, Shacks and Shanties
986,268,Master and Man
467,267,The Princess of Cleves
17198,267,The Botanical Magazine, Vol. 01: Or, Flower-Garden Displayed
17866,267,Murder in the Gunroom
36151,266,Franklin's Autobiography: (Eclectic English Classics)
34856,265,My Own Story
12577,263,Strange True Stories of Louisiana
18338,262,The Complete Poems of Paul Laurence Dunbar
26740,257,The Picture of Dorian Gray
23661,254,The Book of Dragons
30971,251,Industrial Revolution
3748,250,A Journey into the Interior of the Earth
2834,249,The Portrait of a Lady — Volume 2
17502,249,Pen Drawing: An Illustrated Treatise
233,248,Sister Carrie: A Novel
19481,248,"Everyman," with other interludes, including eight miracle plays
30624,248,Alexander the Great: Makers of History
23997,247,Eugene Oneguine [Onegin]: A Romance of Russian Life in Verse
479,246,Little Lord Fauntleroy
2165,242,The Lifted Veil
12186,242,The Principles of Masonic Law: A Treatise on the Constitutional Laws, Usages and Landmarks of: Freemasonry
652,241,Rasselas, Prince of Abyssinia
3526,241,Five Weeks in a Balloon: Or, Journeys and Discoveries in Africa by Three Englishmen
4666,240,Letters from an American Farmer
2667,238,The Vicar of Wakefield
25267,238,Astronomy for Amateurs
50910,238,The Story of Napoleon
19993,237,Childhood's Favorites and Fairy Stories: The Young Folks Treasury, Volume 1
257,236,Troilus and Criseyde
2345,235,The Adventure of the Red Circle
30973,235,East of the Sun and West of the Moon: Old Tales from the North
1591,231,Protagoras
28299,231,The Orbis Pictus
11238,229,The Fight for Conservation
2275,227,The Pioneers; Or, The Sources of the Susquehanna
12060,227,The German Classics of the Nineteenth and Twentieth Centuries, Volume 04: Masterpieces of German Literature Translated into English. in Twenty Volumes
50939,226,The High Hander
19924,225,Plain Facts for Old and Young
25550,225,The Defiant Agents
14417,224,The Agamemnon of Aeschylus: Translated into English Rhyming Verse with Explanatory Notes
31591,224,Language of Flowers
17289,222,The Dance (by An Antiquary): Historic Illustrations of Dancing from 3300 B.C. to 1911 A.D.
5342,220,The Story Girl
1944,217,The Witch, and Other Stories
23639,215,Plutarch's Morals
2726,214,Eight Cousins
468,213,Manon Lescaut
8499,213,Plays: the Father; Countess Julie; the Outlaw; the Stronger
20842,213,Dreams
8209,212,Poems 1817
211,210,The Aspern Papers
12629,210,Language: An Introduction to the Study of Speech
18190,210,Raggedy Ann Stories
4380,206,Under Fire: The Story of a Squad
13065,206,Beethoven's Letters 1790-1826, Volume 1
2562,204,The Clouds
1424,203,Castle Rackrent
17797,203,Memoir of Jane Austen
409,202,Poems on various subjects, religious and moral
1202,202,Tales of Unrest
2948,202,Where Angels Fear to Tread
26998,201,Peter Pan in Kensington Gardens
871,200,The Golden Sayings of Epictetus, with the Hymn of Cleanthes
51043,199,The Good Gray Poet, A Vindication
646,198,The Coral Island: A Tale of the Pacific Ocean
4014,197,Arsene Lupin
30017,197,My Father's Dragon
40284,197,The Sex Life of the Gods
8395,194,The Gods of Pegana
14070,194,English Grammar in Familiar Lectures: Accompanied by a compendium, embracing a new systematic order of parsing, a new system of punctuation, exercises in false syntax, and a system of philosophical grammar, in notes, to which are added an appendix and a key to the exercises : designed for the use of schools and private learners
1152,193,The Story of the Volsungs (Volsunga Saga); with Excerpts from the Poetic Edda
5983,193,The Institutes of Justinian
18466,193,The Æneid of Virgil: Translated into English Verse by E. Fairfax Taylor
2183,190,Three Men on the Bummel
2039,189,Evangeline: A Tale of Acadie
20717,189,The Girl on the Boat
21873,189,Planet of the Damned
17144,188,The House of the Vampire
30221,188,Birds, Illustrated by Color Photography, Vol. 1, No. 1: January, 1897
1514,186,A Midsummer Night's Dream
1777,186,Romeo and Juliet
6605,186,Unconscious Memory
19090,185,Star Hunter
1173,184,The Economist
12389,184,Sappho: One Hundred Lyrics
1118,183,Much Ado about Nothing
3190,183,1601: Conversation as it was by the Social Fireside in the Time of the Tudors
50603,183,Minute Mysteries: [Detectograms]
4724,182,Three Dialogues Between Hylas and Philonous in Opposition to Sceptics and Atheists
20058,182,The Napoleon of Notting Hill
25172,182,Moral Principles in Education
28488,182,Tartuffe; Or, The Hypocrite
7838,181,Fifty-One Tales
32472,181,Food in War Time
7787,180,A Complete Grammar of Esperanto
9909,180,Nightmare Abbey
25024,180,The Night of the Long Knives
47935,180,Fathers and Sons
10741,178,The Essays of Arthur Schopenhauer: the Wisdom of Life
11228,178,The Marrow of Tradition
13614,178,Studies in the Psychology of Sex, Volume 5: Erotic Symbolism; The Mechanism of Detumescence; The Psychic State in Pregnancy
2306,177,Uncle Remus, His Songs and His Sayings
22816,177,The Adventures of Buster Bear
40373,177,A Guide to Health
154,176,The Rise of Silas Lapham
17350,176,The Practice and Theory of Bolshevism
50566,176,Falcons of Narabedla
37381,175,Snowdrop & Other Tales
1755,174,Ivanoff: A Play
3760,174,Sybil, Or, The Two Nations
3804,174,Pierre and Jean
10748,174,The World's Greatest Books — Volume 03 — Fiction
1840,173,The Financier: A Novel
13476,173,Experiments with Alternate Currents of High Potential and High Frequency: A Lecture Delivered before the Institution of Electrical Engineers, London
873,172,A House of Pomegranates
2808,172,Treatises on Friendship and Old Age
23893,172,The Melting-Pot
552,171,The People That Time Forgot
6312,170,Representative Men: Seven Lectures
10586,170,Mike and Psmith
31377,170,Weird Tales. Vol. I (of 2)
15663,169,Ancient Egypt
15877,169,Thoughts of Marcus Aurelius Antoninus
37103,169,Of the Just Shaping of Letters
29903,168,The Sexual Question: A Scientific, psychological, hygienic and sociological study
32202,168,The Irish Fairy Book
39784,168,Mother Goose's Nursery Rhymes: A Collection of Alphabets, Rhymes, Tales, and Jingles
46423,167,A Contribution to The Critique Of The Political Economy
2518,166,The Hungry Stones, and Other Stories
645,165,The Figure in the Carpet
4908,164,Five of Maxwell's Papers
12257,164,The Go-Getter: A Story That Tells You How to be One
23680,164,Sex: Avoided subjects Discussed in Plain English
224,163,A Pair of Blue Eyes
4715,163,An African Millionaire: Episodes in the Life of the Illustrious Colonel Clay
25776,163,This Crowded Earth
25990,163,Bird Houses Boys Can Build
26095,163,The Athenian Constitution
38193,163,New Royal Cook Book
51182,163,History of Greece, Volume 9 (of 12)
1728,162,The Odyssey of Homer, Done into English Prose
3251,162,The Man That Corrupted Hadleyburg, and Other Stories
22925,162,The Story of Young Abraham Lincoln
29255,162,Astounding Stories of Super-Science September 1930
560,161,Mr. Standfast
1034,161,Poems
6684,161,Uneasy Money
29907,161,Modern Painters, Volume 1 (of 5)
16950,160,Goblin Market, The Prince's Progress, and Other Poems
9104,159,The Naval War of 1812: Or the History of the United States Navy during the Last War with Great Britain to Which Is Appended an Account of the Battle of New Orleans
14257,159,The Magician
30723,159,Fathers and Children
50719,159,Juju
482,158,The Woodlanders
1565,157,The Last Days of Pompeii
4391,157,Selections from the Principles of Philosophy
8388,157,Poems By Walt Whitman
41624,157,Futuria Fantasia, Fall 1939
33748,155,The Kitchen Encyclopedia: Twelfth Edition (Swift & Company)
1286,154,Tales from Shakespeare
6519,154,Songs of Kabir
8601,154,The Early Poems of Alfred Lord Tennyson
10339,154,An Antarctic Mystery
15019,153,A Queens Delight: The Art of Preserving, Conserving and Candying. As also, A right: Knowledge of making Perfumes, and Distilling the most Excellent: Waters.
611,152,Prester John
16119,152,Doctrina Christiana: The first book printed in the Philippines, Manila, 1593.
2005,151,Piccadilly Jim
20386,151,Embroidery and Tapestry Weaving
2263,150,Julius Caesar
4230,150,Tom Swift and His Motor-Cycle; Or, Fun and Adventures on the Road
17748,150,The Extermination of the American Bison
31963,150,The Flying Dutchman (Der Fliegende Hollaender): Romantic Opera in Three Acts
32030,150,Selections from Ancient Irish Poetry